"DESCRIPTION","DURATION IN MS","NAME","PARENT SUITE","START TIME","STATUS","STOP TIME","SUB SUITE","SUITE","TEST CLASS","TEST METHOD"
"","1150","Cancelar exclusão de um usuário","","Mon Apr 07 15:12:40 BRT 2025","broken","Mon Apr 07 15:12:41 BRT 2025","","","",""
"","53181","Acessar a página de login com sucesso","","Mon Apr 07 15:11:27 BRT 2025","passed","Mon Apr 07 15:12:20 BRT 2025","","","",""
"","8430","Cancelar processo para adicionar um novo usuário","","Mon Apr 07 15:12:24 BRT 2025","passed","Mon Apr 07 15:12:33 BRT 2025","","","",""
"","53330","Verificar o login com sucesso","","Fri Apr 04 13:34:40 BRT 2025","passed","Fri Apr 04 13:35:34 BRT 2025","","","",""
"","1098","Excluir um usuário existente","","Mon Apr 07 15:12:41 BRT 2025","broken","Mon Apr 07 15:12:42 BRT 2025","","","",""
"","6282","Adicionar um novo usuário","","Mon Apr 07 15:12:33 BRT 2025","broken","Mon Apr 07 15:12:39 BRT 2025","","","",""
"","2279","Visualizar usuários cadastrados","","Mon Apr 07 15:12:22 BRT 2025","passed","Mon Apr 07 15:12:24 BRT 2025","","","",""
"","2177","Administrador acessa a tela de usuários","","Mon Apr 07 15:12:20 BRT 2025","passed","Mon Apr 07 15:12:22 BRT 2025","","","",""
"","1158","Editar um usuário existente","","Mon Apr 07 15:12:39 BRT 2025","broken","Mon Apr 07 15:12:40 BRT 2025","","","",""
