"DESCRIPTION","DURATION IN MS","NAME","PARENT SUITE","START TIME","STATUS","STOP TIME","SUB SUITE","SUITE","TEST CLASS","TEST METHOD"
"","19111","Cancelar exclusão de um usuário","","Mon Apr 07 10:18:03 BRT 2025","failed","Mon Apr 07 10:18:22 BRT 2025","","","",""
"","16852","Excluir um usuário existente","","Mon Apr 07 10:18:22 BRT 2025","failed","Mon Apr 07 10:18:39 BRT 2025","","","",""
"","12863","Adicionar um novo usuário","","Mon Apr 07 10:17:33 BRT 2025","passed","Mon Apr 07 10:17:46 BRT 2025","","","",""
"","2273","Visualizar usuários cadastrados","","Mon Apr 07 10:17:22 BRT 2025","passed","Mon Apr 07 10:17:25 BRT 2025","","","",""
"","53330","Verificar o login com sucesso","","Fri Apr 04 13:34:40 BRT 2025","passed","Fri Apr 04 13:35:34 BRT 2025","","","",""
"","52612","Acessar a página de login com sucesso","","Mon Apr 07 10:16:27 BRT 2025","passed","Mon Apr 07 10:17:20 BRT 2025","","","",""
"","2170","Administrador acessa a tela de usuários","","Mon Apr 07 10:17:20 BRT 2025","passed","Mon Apr 07 10:17:22 BRT 2025","","","",""
"","8412","Cancelar processo para adicionar um novo usuário","","Mon Apr 07 10:17:25 BRT 2025","passed","Mon Apr 07 10:17:33 BRT 2025","","","",""
"","16944","Editar um usuário existente","","Mon Apr 07 10:17:46 BRT 2025","passed","Mon Apr 07 10:18:03 BRT 2025","","","",""
