"DESCRIPTION","DURATION IN MS","NAME","PARENT SUITE","START TIME","STATUS","STOP TIME","SUB SUITE","SUITE","TEST CLASS","TEST METHOD"
"","17451","Excluir um usuário existente","","Thu Mar 27 15:31:34 BRT 2025","failed","Thu Mar 27 15:31:52 BRT 2025","","","",""
"","2627","Visualizar usuários cadastrados","","Thu Mar 27 15:30:34 BRT 2025","passed","Thu Mar 27 15:30:37 BRT 2025","","","",""
"","54121","Acessar a página de login com sucesso","","Thu Mar 27 15:29:37 BRT 2025","passed","Thu Mar 27 15:30:31 BRT 2025","","","",""
"","13904","Adicionar um novo usuário","","Thu Mar 27 15:30:46 BRT 2025","passed","Thu Mar 27 15:31:00 BRT 2025","","","",""
"","2533","Administrador acessa a tela de usuários","","Thu Mar 27 15:30:31 BRT 2025","passed","Thu Mar 27 15:30:34 BRT 2025","","","",""
"","19540","Cancelar exclusão de um usuário","","Thu Mar 27 15:31:15 BRT 2025","failed","Thu Mar 27 15:31:34 BRT 2025","","","",""
"","15201","Editar um usuário existente","","Thu Mar 27 15:31:00 BRT 2025","failed","Thu Mar 27 15:31:15 BRT 2025","","","",""
"","9113","Cancelar processo para adicionar um novo usuário","","Thu Mar 27 15:30:37 BRT 2025","passed","Thu Mar 27 15:30:46 BRT 2025","","","",""
